{"$schema":"https://json-schema.org/draft/2020-12/schema","$id":"https://kaveep.dev/dev-agent/schemas/sandbox-result.schema.json","title":"KAVEEP DEV-AGENT Sandbox Result","type":"object","required":["sandboxResultId","schemaVersion","sandboxRequestRef","sandboxId","status","sandboxRoot","manifestRef","startedAt","completedAt","durationMs","copiedFiles","copiedBytes","warnings","errors","limitations","cleanupRequired","cleanupStatus","sideEffectsObserved","recommendedNextAction","evidenceRefs","auditRefs"],"properties":{"sandboxResultId":{"type":"string","pattern":"^sandbox_result_[A-Za-z0-9][A-Za-z0-9_-]*$"},"schemaVersion":{"type":"string","pattern":"^[0-9]+\\.[0-9]+\\.[0-9]+$"},"sandboxRequestRef":{"type":"string","pattern":"^sandbox_request_[A-Za-z0-9][A-Za-z0-9_-]*$"},"sandboxId":{"type":"string","pattern":"^sandbox_[A-Za-z0-9][A-Za-z0-9_-]*$"},"status":{"type":"string","enum":["preparing","ready","ready_with_warnings","blocked","failed","expired","cleaned","no_action","unverified"]},"sandboxRoot":{"type":"string"},"manifestRef":{"type":"string"},"startedAt":{"type":"string","format":"date-time"},"completedAt":{"type":"string","format":"date-time"},"durationMs":{"type":"integer","minimum":0},"copiedFiles":{"type":"integer","minimum":0},"copiedBytes":{"type":"integer","minimum":0},"warnings":{"type":"array","items":{"$ref":"sandbox-manifest.schema.json#/$defs/message"}},"errors":{"type":"array","items":{"$ref":"sandbox-manifest.schema.json#/$defs/message"}},"limitations":{"type":"array","items":{"type":"string"}},"cleanupRequired":{"type":"boolean"},"cleanupStatus":{"type":"string","enum":["not_required","required","completed","failed"]},"sideEffectsObserved":{"type":"array","maxItems":0},"recommendedNextAction":{"type":"string","enum":["no_action","review_sandbox","cleanup_sandbox","gather_more_evidence","block_request"]},"evidenceRefs":{"type":"array","items":{"$ref":"../../KAVEEP-CORE/schemas/evidence-ref.schema.json"}},"auditRefs":{"type":"array","items":{"$ref":"../../KAVEEP-CORE/schemas/audit-ref.schema.json"}}},"additionalProperties":false}
