{"sandboxResultId":"sandbox_result_example_001","schemaVersion":"1.0.0","sandboxRequestRef":"sandbox_request_example_001","sandboxId":"sandbox_example_001","status":"ready","sandboxRoot":"C:/Temp/kaveep-sandbox-example","manifestRef":"C:/Temp/kaveep-sandbox-example/sandbox-manifest.json","startedAt":"1970-01-01T00:00:00.000Z","completedAt":"1970-01-01T00:00:00.000Z","durationMs":0,"copiedFiles":1,"copiedBytes":1024,"warnings":[],"errors":[],"limitations":["No code was executed.","Sandbox creation does not authorize external write-back."],"cleanupRequired":true,"cleanupStatus":"required","sideEffectsObserved":[],"recommendedNextAction":"review_sandbox","evidenceRefs":[{"evidenceId":"evidence_sandbox_request_001","evidenceType":"sandbox_request","verificationStatus":"verified","sourceType":"human_input","createdAt":"1970-01-01T00:00:00.000Z"}],"auditRefs":[]}
